{
  "id": "20260831-优化登录流程",
  "objective": "优化登录流程",
  "status": "active",
  "created_at": "2026-08-27T12:00:00Z",
  "updated_at": "2026-08-27T12:03:00Z",
  "updated_by": "old-zhou/example-session",
  "revision": 1,
  "source_temporary": "20260831-登录流程梳理",
  "promotion_transaction": "20260831T120000Z-p7q8r9",
  "promoted_at": "2026-08-31T12:00:15Z"
}
